guid,nyu.libraries.collection,dc.title,dc.identifier,dc.subject.tag,dc.subject.tag,dc.subject.tag,dc.subject.tag,dc.subject.tag,dc.subject.tag,dc.subject.controlled,dc.descriptiondataServices001,DataServices,Administration for Children and Families Child Care and Development Fund Data and Statistics,http://www.acf.hhs.gov/programs/ccb/data/index.htm,Education,Child Care,Demograhic Characteristics,,,,Area & Cultural Studies,"Child Care and Development Fund Statistics, Child Care and Development Fund Expenditure Data, and related government programs."dataServices002,DataServices,ALFRED Archival Federal Reserve Economic Data,http://alfred.stlouisfed.org/,Economics,,,,,,Business & Economics (US),"ALFRED allows you to retrieve vintage versions of economic data that were available on specific dates in history. In general, economic data for past observation periods are revised as more accurate estimates become available. As a result, previous vintages of data can be superseded and may no longer be available from various data sources. Vintage or real time economic data allows academics to reproduce others' research, build more accurate forecasting models, and analyze economic policy decisions using the data available at the time."dataServices003,DataServices,American FactFinder,http://factfinder2.census.gov/faces/nav/jsf/pages/searchresults.xhtml?refresh=t,Demograhic Characteristics,Education,Population,census data,demographic characteristics,population,Population & Demography,"Gateway/Portal to 2000 US Census data, including population, housing, economic, and geographic data. Also includes American Community Survey, Population Estimates, Economic Census and Annual Economic Surveys."dataServices004,DataServices,American Federation of Teachers Salary Survey,http://www.aft.org/yourwork/teachers/reports/salarybystate07.cfm,Education,Salaries,,,,,Education,"AFT statistics are gathered from an annual Teacher Salary Survey and include the ""Survey and Analysis of Teacher Salary Trends"" and the ""AFT Public Employees Compensation Survey."" Reports are in .pdf format."dataServices005,DataServices,American National Election Studies (ANES),http://www.electionstudies.org/,Politics,,,voting behavior,public opinion,public policy,Policy & Political Science,"The American National Election Studies (ANES) produces high quality data on voting, public opinion, and political participation to serve the research needs of social scientists, teachers, students, policy makers and journalists who want to better understand the theoretical and empirical foundations of national election outcomes."dataServices006,DataServices,Association of Religion Data Archive (ARDA),http://www.thearda.com/,Religion,,,religion,religious attitudes,religious affiliation,Philosophy & Religion,"The ARDA Data Archive is a collection of surveys, polls, and other data submitted by researchers, and includes nearly 400 data files. Currently housed in the Social Science Research Institute at the Pennsylvania State University, the ARDA is funded by the Lilly Endowment, the John Templeton Foundation, and the Pennsylvania State University. Includes National Profiles, U.S. Denominations, and GIS Maps and Reports regarding religion."dataServices007,DataServices,IMF Balance of Payment Statistics,https://arch.library.nyu.edu/databases/proxy/NYU02532,International Marketing,Nation Data,Trade,,,,Business & Economics (Intl),International Monetary Fund trade statistics.dataServices008,DataServices,IMF Direction of Trade Statistics,https://arch.library.nyu.edu/databases/proxy/NYU02533,Trade,International,,,,,Business & Economics (Intl),International Monetary Fund trade statistics.dataServices009,DataServices,Behavioral Risk Factor Surveillance System,http://www.cdc.gov/brfss/,Health,Healthcare,,,,,"Health, Nursing & Nutrition","The BFRSS is a state-based system of health surveys that generates information about health risk behaviors, clinical preventative practices, and health care access and use primarily related to chronic diseases and injury.  States use standardized procedures to collect data through monthly telephone interviews."dataServices010,DataServices,Bloomberg,,Financial Markets,Economic Indicators,Company Info,Securities,Finance,,Business & Economics (US),"Provides analysis and quotes for equities and indices around the globe, current company, industry and market news, and economic data for the countries of the world. **This resource is only accessible in Bobst Library. To use this resource, stop by the 5th floor Reference Center."dataServices011,DataServices,Bureau of Justice Statistics,http://www.ojp.usdoj.gov/bjs/,Offenses,Criminal Justice,,,,,Policy & Political Science,"Statistics related to crimes, victims, law enforcement, and criminal justice in the United States."dataServices012,DataServices,Bureau of Labor Statistics,http://www.bls.gov/,Labor,Employment,,,,,Policy & Political Science,"Data related to employment, unemployment, wages, consumer and business spending, occupations, safety, and health in the United States."dataServices013,DataServices,Bureau of Transportation Statistics,http://www.bts.gov,Transportation,Airline,Freight,,,,Population & Demography,"Information and data related to the transportation industry, including household-level data; includes transportation economics, freight data, border crossing-data, and commodities transported."dataServices014,DataServices,Bytes of the Big Apple,http://www.nyc.gov/html/dcp/html/bytes/applbyte.shtml,GIS,,,,,,Geographic Information Systems,"BYTES of the BIG APPLE is a family of software, data and geographic base map files for the City of New York. The Department of City Planning offers these products for free download or by a license agreement."dataServices015,DataServices,Cambridge Structural Database,https://ezproxy.library.nyu.edu/login?url=http://library.nyu.edu/beta/collections/standalone.html,Crystallography,,,,,,Science & Technology,"The world repository of small molecule crystal structures. The Cambridge Structural Database (CSD) is the principal product of the Cambridge Crystallographic Data Centre. It is the central focus of the CSD System, which also comprises software for database access, structure visualisation and data analysis, and structural knowledge bases derived from the CSD."dataServices016,DataServices,CDC Syndromic Surveillance Page,http://www.cdc.gov/epo/dphsi/syndromic.htm,Health,,,,,,"Health, Nursing & Nutrition","Syndromic surveillance involves the monitoring of routine public health data for evidence of potential health outbreaks. This is particularly critical for determining whether an act of bioterrorism has occurred. This web page provides a framework for the evaluation of public health surveillance programs, definitions for identifying the syndromes associated with bioterrorism incidents, and an annotated bibliography about syndromic surveillance."dataServices019,DataServices,Center for International Development and Conflict Management (U. of Maryland),http://www.cidcm.umd.edu/,Minorities,Political Conflict,,,,,Area & Cultural Studies,"Several large data collection projects reside at CIDCM, providing a broad foundation for much of the center's research. The International Crisis Behavior project gathers data on all international crises since the end of World War I. The Minorities at Risk project monitors the status of politically-active communal groups around the world. Peace and Conflict 2008 provides key analyses about trends in armed conflict, democratization, and instability worldwide."dataServices020,DataServices,Centers for Disease Control,http://www.cdc.gov,Health,,,,,,"Health, Nursing & Nutrition","Data related to birth, death, aging, health, disease, marriage in the United States. "dataServices021,DataServices,Child Care and Early Education Research Connections,http://www.childcareresearch.org/childcare/data.jsp,Education,Children,Poverty,,,,Education,"A comprehensive, up-to-date, and easy-to-use collection of more than 10,000 resources from the many disciplines related to child care and early education."dataServices022,DataServices,Children's Defense Fund,http://www.childrensdefense.org/site/PageServer?pagename=research,Population,,,,,,Population & Demography,"Longitudinal and cross-sectional data on a variety of issues of importance to researchers interested in the social conditions of children and families including children and gun violence, poverty, childcare, joblessness, grandparents raising grandchildren, and some statistical information on ""No Child Left Behind."""dataServices023,DataServices,China Data Online,https://arch.library.nyu.edu/databases/proxy/NYU02238,Demographics,Census Data,,Demographics,Census Data,Economic Indicators,Business & Economics (Intl),"Comprehensive database Web site focusing on economic statistics of China, arranged by regions and categories. Includes monthly and yearly reports on China's macroeconomic development, statistical databases about China's population and economy at the county and city level, and financial indicators of more than 568 industrial branches. Also includes statistical yearbooks, census data, industrial and marketing surveys, and an atlas of China."dataServices024,DataServices,Common Core of Data,http://nces.ed.gov/ccd/index.asp,Education,,,,,,Education,"The Common Core of Data (CCD) is a program that annually collects fiscal and non-fiscal data about all public schools, public school districts, and state education agencies. The data include contact information for agencies as well as descriptive information about students and staff and fiscal data."dataServices025,DataServices,Center for Applied Research and Environmental Systems,http://www.cares.missouri.edu/,Health,Economic Indicators,Human Services,,,,"Health, Nursing & Nutrition","CARES' mission is to link public information and spatial dynamics for timely policy decision-support, through interactive visualization and spatial analysis. In 2008, CARES merged with the former Community Information Resource Center (CIRC) and Rural Policy Research Institute (RUPRI)."dataServices026,DataServices,Comparative Indicators of Education in the United States and Other G8 Countries,http://nces.ed.gov/pubsearch/pubsinfo.asp?pubid=2005021,Education,International Education,,,,,Education,"This report shows how the U.S. education system compares to other major industrialized countries (Canada, France, Germany, Italy, Japan, Russian Federation, United Kingdom) in four areas: (1) the context of education; (2) preprimary and primary education; (3) secondary education; and (4) higher education. This report is an update of the 2002 G8 Report, and is part of a series to be published in alternate years. Available in .pdf format."dataServices027,DataServices,UN Comtrade,http://comtrade.un.org/,Trade,,,International Trade,,,Business & Economics (Intl),"Every year over 130 countries provide the United Nations Statistics Division with their annual international trade statistics, detailed by commodity and partner country. These data are processed into a standard format with consistent coding and valuation. All values are converted into US dollars using exchange rates supplied by the countries, or derived from monthly market rates and volume of trade."dataServices028,DataServices,"County and city data book, 1944 through 2000 (University of Virginia Library)",http://fisher.lib.virginia.edu/collections/stats/ccdb/,Demographics,,,,,,Population & Demography,This resource provides access to the 1944 through 2000 County and City Data Books. This service provides the opportunity to create custom printouts and/or customized data subsets (subsets only available for 1988-2000).dataServices029,DataServices,Consumer Price Index (CPI) Detailed Report,http://www.bls.gov/cpi/,Consumer Price Index,Economic Indicators,,,,,Business & Economics (US),"A monthly report covering consumer price movements. The data is separated into the Consumer Price Index for All Urban Consumers and for Wage Earners and Clerical Workers, reflecting data for U.S. city averages and selected areas. Covers the prices of the necessities of daily life--food, shelter, clothing, transportation, etc."dataServices030,DataServices,Cultural Policy and the Arts National Data Archive (CPANDA),http://www.cpanda.org/,Arts,Cultural Policy,,,,,Art,"CPANDA provides public access to data sets on art and cultural policy.  Some of the data is longitudinal and some is cross-sectional.  Topics that are addressed included public perceptions of art, the socio-economic experiences of artists themselves, biographical information on trustees of large nonprofit organizations, classical music and local orchestras, role of museums, the Brooklyn Museum of Art controversy of 1999, and culture and creativity in communities."dataServices031,DataServices,Datastream,,Economic Indicators,Financial Markets,Company Info,Economic Indicators,Finance,Securities,Business & Economics (Intl),"Datastream provides data on the financial markets of the world: comprehensive company data, foreign stock and bond indices, an time series from the IMF and OECD. Updated daily and in many cases, historical data available for the past 20-25 years. **This resource is only accessible in Bobst Library. To use this resource, stop by the 5th floor Reference Center."dataServices032,DataServices,"Digital Sanborn maps: New York, 1867-1970",https://ezproxy.library.nyu.edu/login?url=http://sanborn.umi.com/,"Insurance, Fire -- New York (State) -- Maps. ",Surveys -- New York (State) -- Maps. ,New York (State) -- Maps. ,,,,Geographic Information Systems,"Digital Sanborn Maps is a collection of large-scale landbook maps which include information such as building outlines, size, shape, height, and construction materials, function of structures, and locations of windows and doors. The maps also give street names, street and sidewalk widths, property boundaries, and house and block numbers. Textual information includes construction details, ownership and building use. Includes most of the fire insurance maps of New York State produced by the Sanborn Map Company from the mid-1880s to around 1950. The black and white digital images were produced from microform of the Sanborn maps in the Library of Congress collection. Digital collection is searchable by city and date."dataServices034,DataServices,DOIIT New York City Department of Information Technology and Telecommunications GIS Data,http://www.nyc.gov/html/doitt/html/eservices/eservices_gis.shtml,Telecommunications,,,,,,Science & Technology,"GIS data for New York City including building footprints, hydrography, open space, and transportation maps. Provided by the New York City Department of Information Technology and Telecommunications (DoITT)."dataServices035,DataServices,Early Childhood Atlas,http://www.earlychildhood.msstate.edu/atlas/,Education,Child Care,Demograhic Characteristics,,,,Area & Cultural Studies,"The Early Childhood Atlas, developed by the National Center for Rural Early Childhood Learning Initiatives at the Early Childhood Institute of Mississippi State University and the Rural Policy Research Institute, offers a set of easy-to-use online tools to access early childhood data across the 50 states, and counties and municipalities within states. Includes a map-making tool."dataServices036,DataServices,Economic Census,http://www.census.gov/econ/census07/,Economy,Business,,,,,Business & Economics (US),"The Economic Census from the US Census Bureau provides a detailed portrait of the US economy once every five years, from the national to the local level.  Data is available at the industry and geographic level, and the survey of business owners is included."dataServices037,DataServices,Economic Indicators (GPO),http://www.gpoaccess.gov/indicators/index.html,Economic Indicators,,,,,,Business & Economics (US),Includes tables and charts of basic economic indicators from the Government Printing Office (GPO). The data is generally quoted for about 8 or 9 years and then quarterly for the most recent 3 years.dataServices038,DataServices,Education and Training Statistics for the United Kingdom,http://www.dfes.gov.uk/rsgateway/DB/VOL/v000431/index.shtml,Education,,,,,,Education,"An integrated overview of statistics on education and training in the UK, in some 60 tables. Chapters relate to expenditure; schools; post-compulsory education and training; qualifications; destinations; population, and international comparisons"dataServices039,DataServices,Education Trends in Perspective: Analysis of the World Education Indicators,http://www.uis.unesco.org/ev.php?ID=6192_201&ID2=DO_TOPIC,Education,International Education,,,,,Education,"Includes 19 middle-income countries comprising over 50 per cent of the world population. By analysing trends in WEI countries between 1995 and 2003 and comparing them to OECD countries, this volume examines the factors which can generate growth in education in one country and constrain it in another. The countries participating in WEI include: Argentina, Brazil, Chile, China, Egypt, India, Indonesia, Jamaica, Jordan, Malaysia, Paraguay, Peru, the Philippines, the Russian Federation, Sri Lanka, Thailand, Tunisia, Uruguay and Zimbabwe. This site contains statistical tables, which were published in the report, in an electronic format (EXCEL), along with data tables complementing the presented tables, such as data by gender or additional age groups and teacher salaries as percentage of GDP. There is also a link to the full set of questionnaires used to gather the education data for this publication."dataServices040,DataServices,EIU City Data,https://arch.library.nyu.edu/databases/proxy/NYU02705,Economic Indicators,,,Economic Indicators,Cities,,Business & Economics (Intl),A global database of product prices and business costs providing over 330 price levels on more than 160 products and services in 123 cities worldwide from 1990 to the present. dataServices041,DataServices,EIU Country Data,https://arch.library.nyu.edu/databases/proxy/NYU02713,Economic Indicators,,,Economic Indicators,,,Business & Economics (Intl),"More than 280 economic series, over 1 million individual data points, from 1980 onwards. The service contains concise summaries of our short-term political and economic forecasts on 181 countries."dataServices042,DataServices,EIU Country Forecast,https://arch.library.nyu.edu/databases/proxy/NYU02709,Economic Indicators,Forecasting,Businesses,Economic Indicators,Forecasting,Businesses,Business & Economics (Intl),"Country Forecasts present and explain the Economist Intelligence Unit's five-year macroeconomic projections for 60 of the world's largest economies. They also provide an in-depth medium-term political and policy outlook, as well as forward-looking assessments of the business environment."dataServices043,DataServices,EIU Market Indicators and Forecasts,https://arch.library.nyu.edu/databases/proxy/NYU02714,Demographics,Economic Indicators,Business Risk,,Businesses,Risk,Business & Economics (Intl),"Demographics, consumption, average wages, income levels, market size, infrastructure and the business environment data on 60 key countries worldwide. Contains over 500 series stretching back to 1990 and forward five years."dataServices044,DataServices,eMarketer,http://www.emarketer.com/Extranet.aspx?nyu,Market Analysis,International Marketing,,,,,Business & Economics (Intl),"Data and analysis on the latest e-business, internet, and technology trends."dataServices045,DataServices,Equal Employment Opportunity Files,http://www.census.gov/hhes/www/eeoindex/eeoindex.html,Education,Occupation,,employment discrimination,racial discrimination,gender discrimination,Area & Cultural Studies,"Special tabulation for states, places, and counties or county groups of 50,000+; Detailed occupation by sex and race tabulated for workplaces and residences; Educational attainment by sex, race and age."dataServices046,DataServices,Eurobarometer (The European Union),http://ec.europa.eu/public_opinion/index_en.htm,Europe,Public Opinion,,,,,Policy & Political Science,"Euro barometer includes results of surveys and studies by the European Commission, begun in 1973, which address major topics concerning European citizenship: enlargement, social situation, health, culture, information technology, environment, the Euro, defense, etc."dataServices047,DataServices,Eurostat,http://epp.eurostat.ec.europa.eu/portal/page/portal/eurostat/home,Europe,,,,,,Area & Cultural Studies,"Eurostat data covers the European Union, its Member States and its partners, and are published under a variety of Themes and Collections."dataServices048,DataServices,Fast Facts about Education,http://nces.ed.gov/fastfacts/,Education,,,,,,Education,"Quick statistical information on a variety of US education topics, with links to supporting studies. Updated regularly."dataServices049,DataServices,Federal Reserve Economic Data - FRED,http://research.stlouisfed.org/fred2/,Economic,,,,,,Business & Economics (US),"FRED (Federal Reserve Economic Data) is a database of over 15,000 US economic time series. "dataServices050,DataServices,FedStats,http://www.fedstats.gov/,Government Statistics,,,,,,Policy & Political Science,"Lists detailed information and provides links to more than 100 different federal statistical agencies. Searchable via a search engine, by lists of data generating agencies or by their data, via a ""reference shelf,"" by geographical and map searches, and by a list of data extraction engines. The site also lists contacts at the various agencies."dataServices051,DataServices,UNESCO Institute for Statistics: Financing Education - Investments and Returns,http://www.uis.unesco.org/ev.php?URL_ID=5245&URL_DO=DO_TOPIC&URL_SECTION=201,Education,International Education,,,,,Education,Financing Education - Investments and Returns is the third in a series of reports that analyze education indicators developed through the World Education Indicators Programme (WEI). This report looks at the impact of human capital on economic growth and examines education spending and investment strategies from both public and private perspectives.dataServices052,DataServices,GenderStats,"http://web.worldbank.org/WBSITE/EXTERNAL/TOPICS/EXTGENDER/EXTANATOOLS/EXTSTATINDDATA/EXTGENDERSTATS/0,,contentMDK:21347401~menuPK:4851945~pagePK:64168427~piPK:64168435~theSitePK:3237336,00.html",Education,Gender Studies,Health,,,,Area & Cultural Studies,"National-level statistical data from The World Bank on poverty, education, health, labor force, and political participation broken down by gender; approach data by country and then theme or via the country profiles."dataServices053,DataServices,Geodata.gov: U.S. Maps and Data,http://gos2.geodata.gov/wps/portal/gos/kcxml/04_Sj9SPykssy0xPLMnMz0vM0Y_QjzKL9443cnIFSYGYfpb6kehCFgghb31fj_zcVP0A_YLc0IhyR0VFABDAZM0!/delta/base64xml/L3dJdyEvUUd3QndNQSEvNElVRS82X0tfVlFQ,GIS,,,,,,Geographic Information Systems,"geodata.gov is a geographic information system (GIS) portal, also known as the Geospatial One-Stop (GOS), that serves as a public gateway for improving access to geospatial information and data under the Geospatial One-Stop E-Government initiative. Geospatial One-Stop is one of 24 E-Government initiatives sponsored by the Federal Office of Management and Budget (OMB) to enhance government efficiency and to improve citizen services."dataServices054,DataServices,Global Development Finance,http://ddp-ext.worldbank.org/ext/DDPQQ/member.do?method=getMembers&userid=1&queryId=5,Developing Countries,Economic Indicators,Debt,,Debt,Economic Indicators,Business & Economics (Intl),Data from The World Bank provides developments in international lending to developing countries and external debt tables for over 100 countries. Analysis and commentary is also provided.dataServices055,DataServices,Global Education Database,http://ged.eads.usaidallnet.gov/,Education,,,,,,Education,Includes data from the UNESCO Institute of Statistics and USAID's Demographic & Health Surveys.dataServices057,DataServices,Global Financial Data,https://arch.library.nyu.edu/databases/proxy/NYU02515,Economic Indicators,Financial Markets,Securities,Securities,Finance,Economic Indicators,Business & Economics (Intl),"20,000 historical and current data series on global finance topics."dataServices058,DataServices,Global Health Topics,http://www.globalhealth.gov/topics/index.html,Health,Public Health,,,,,"Health, Nursing & Nutrition",A portal from the US Department of Health and Human Services to research resources related to international health topics.dataServices059,DataServices,Global Market Information Database,https://ezproxy.library.nyu.edu/login?url=http://library.nyu.edu/restricted/collections/#gmid,Consumers,demographics,marketing,Marketing,Consumers,Demoraphics,Business & Economics (Intl),"GMID (Euromonitor) includes 28 years of market statistics from dozens of global industries. Includes market size, country marketing parameters and forecasting data. **NYU NetID and Password required."dataServices060,DataServices,Head Start Program Fact Sheets,http://www.acf.hhs.gov/programs/ohs/about/index.html#factsheet,Education,,,,,,Education,"Head Start budget, enrollment, demographic and program figures are presented in tables for the past five years."dataServices061,DataServices,U.S. Department of Health and Human Services,http://www.hhs.gov,Health,Social Services,,,,,"Health, Nursing & Nutrition","Portal to information related to families and children, health and social services, provided by a family of federal agencies."