guid,nyu.libraries.collection,dc.title,dc.identifier,dc.subject.tag,dc.subject.tag,dc.subject.tag,dc.subject.tag,dc.subject.tag,dc.subject.tag,dc.subject.controlled,dc.descriptiondataServices062,DataServices,"Historical Statistics of the United States, Colonial Times to 1970",https://arch.library.nyu.edu/databases/proxy/NYU02524,Economic Indicators,Population,Income,,,,Business & Economics (US),"Demographic, social and economic statistical series from the inception of each statistical measure to 1970. General explanations and historical notes are given at the beginning of each chapter."dataServices063,DataServices,Integrated Public Use Microdata Series (IPUMS),http://www.ipums.umn.edu/,Population,,,,,,Population & Demography,"The three major data infrastructure projects of the Minnesota Population center include:  IPUMS-International; an integrated series of census microdata samples from 1960 to the present; IPUMS-USA, an integrated series of representative samples drawn from the U.S. censuses of the period from 1850 to 2000; and IPUMS-USA, which also includes American Community Survey (ACS) data from 2000 to 2005. IPUMS-CPS provides integrated data and documentation from the March Current Population Survey (CPS) from 1962 to 2006. Other datasets include the North Atlantic Population Project, the National Historical Geographic Information System, and the Integrated Health Interview Series."dataServices064,DataServices,Inter-University Consortium for Political and Social Research (ICPSR),http://www.icpsr.umich.edu/,Data Archive,,,,,,Data Archives,"ICPSR contains the largest collection of social science data available.  The topics covered are innumerable and data can be both quantitative or qualitative in nature.  Special data archives include ""Census 2000 at ICPSR,"" ""Child Care and Early Education Research Connections,"" ""Election 2000 at ICPSR,"" ""Health and Medical Care Archive,"" ""Homicide Research Working Group,"" ""International Archive of Education Data,"" ""National Archive of Computerized Data on Aging,"" ""National Archive of Criminal Justice Data,"" ""Project on Human Development in Chicago Neighborhoods,"" and ""Substance Abuse & Mental Health Data Archive."" NYU users should create a MyData account using their NYU email address to download data sets."dataServices065,DataServices,International Archive of Education Data,http://www.icpsr.umich.edu/IAED/,Education,,,,,,Education,"The Archive acquires, processes, documents, and disseminates data collected by national, state or provincial, local, and private organizations, pertaining to all levels of education in countries for which data can be made available.  Data files, documentation, and reports are downloadable from the website in public-use format. The website features an online data analysis system (DAS) that allows users to conduct analyses on selected datasets within the Archive."dataServices068,DataServices,International Comparisons in Education,http://nces.ed.gov/surveys/international/,Education,,,,,,Education,"Reports, data bases, studies and speeches on educational achievement in participating studies. Subjects include math, reading, science, civic education, and adult literacy."dataServices069,DataServices,"International Education Indicators: A Time Series Perspective, 1985-1995 (PDF)",http://nces.ed.gov/pubs2000/2000021.pdf,Education,International Education,,,,,Education,"International Education Indicators: A Time Series Perspective, 1985-1995 compares educational trends in economically developed countries over time. The countries examined in this report are members of the Organization for Economic Co-operation and Development (OECD), an organization of 29 countries dedicated to promoting economic growth and development around the world. This report extends the earlier National Center for Education Statistics (NCES) publication International Education Indicators: A Time Series Perspective from a seven-to an 11-year time series to provide a more comprehensive picture of continuity and change in countries' education systems."dataServices070,DataServices,International Financial Statistics Online,https://arch.library.nyu.edu/databases/proxy/NYU02545,Economic Indicators,,,Economic Indicators,,,Business & Economics (Intl),"Major economic aggregates used in the analysis of economic developments, including data such as production and prices. Selected series are compiled into world tables making for easier comparability."dataServices071,DataServices,International Social Survey Programme,http://www.issp.org/data.shtml,Demographics,,,public opinion,,,Population & Demography,"A collection of surveys including subjects such as government, citizenship, national identity, social relationships, family, and environment, coordinated cross-nationally."dataServices073,DataServices,International Trade Statistics Yearbook,http://unstats.un.org/unsd/trade/default.htm,International Marketing,Nation Data,Trade,,,,Business & Economics (Intl),"Volume 1 by country, volume 2 by commodity. Amounts and values of exports and imports by commodity and country. Uses SITC (Statistics of International Trade in Services) codes."dataServices074,DataServices,iPOLL,http://roperweb.ropercenter.uconn.edu/cgi-bin/hsrun.exe/Roperweb/iPOLL/iPOLL.htx;start=HS_iPOLL_LoginSetup,Public Opinion,,,,,,Policy & Political Science,"iPOLL Databank, from the Roper Center for Public Opinion Research, contains half a million survey questions and answers asked in the US over the last 65 years by more than 150 survey organizations. Registration required."dataServices075,DataServices,ISI Emerging Markets,https://ezproxy.library.nyu.edu/login?url=http://site.securities.com,Industry,Economic Indicators,Developing Countries,Economic Indicators,Industry,Developing Countries,Business & Economics (Intl),"Financial information, news and business intelligence for 25 emerging countries. Coverage includes company profiles, financial statements and earnings estimates, analyst reports for companies and industries, current and historical market information, economic statistics and forecasts, and current news."dataServices076,DataServices,Islamic Finance Information Service (IFIS),http://site.securities.com/ifis/,Sharia,Financial Markets,Middle East,Banking,Finance,Islamic Law,Business & Economics (Intl),"IFIS focuses exclusively on the developments in the Islamic financial world. Find information on: Islamic financial Guidelines and legal content from regulatory bodies; League Tables for Islamic bonds, deals & transactions detailing structure of issues, issuers, term sheets and conditions; rankings of the top industry players; database of top global law firms involved in Islamic finance; Shariah rulings, financial market information; current news, events, academic and research papers."dataServices077,DataServices,JPoll,http://www.ropercenter.uconn.edu/jpoll/home.html,Public Opinion,,,,,,Policy & Political Science,"JPOLL contains more than 10,000 public opinion questions and the respective responses from Japan's major survey research sources. These studies cover social, political, and economic topics throughout the current decade. Users can search for public opinion questions using keywords, topics, dates, and organizations as search criteria. Registration required."dataServices078,DataServices,Linking Economic Development and Child Care 50 State Database,http://government.cce.cornell.edu/doc/reports/childcare/50state.asp,Education,Child Care,Demograhic Characteristics,,,,Education,"This database provides an overview of all current, national sources of comparative data on the early care and education sector including: child care economic data, demographic data, and early care and education program (policy) data. Thirty one sources are profiled. These include federal census and administrative data, federal survey data, and national organizations that collect or maintain comparative data on children and families or early care and education more generally. The Description of Data Sources provides information on each data source, variables collected, and hotlinks to each organization's web site to access the raw data. We also provide hotlinks to the relevant section in the Cornell Methodology Guide that discusses the issues to consider when using such data in a regional analysis of the economic importance of child care."dataServices080,DataServices,MarketResearch.com,https://arch.library.nyu.edu/databases/proxy/NYU02697,Market Research,Product Data,,,,,Business & Economics (Intl),Global market research reports and analyses.dataServices081,DataServices,Maternal and Child Health Bureau,http://mchb.hrsa.gov/data/,Women,Children,Health,pregnancy,mothers,infants,Area & Cultural Studies,Contains the Women's Health Report and Child Health USA.dataServices082,DataServices,Mergent Online,https://arch.library.nyu.edu/databases/proxy/NYU02377,Company Info,Securities,Finances,Companies,Securities,,Business & Economics (Intl),"Financial filings, summary balance sheets and income statements, corporate histories, long term debt, bond ratings and more, for publicly held companies worldwide."dataServices083,DataServices,Meridian Online,https://arch.library.nyu.edu/databases/proxy/NYU02379,Stock Indices,Stock Exchanges,Financial Markets,Securities,Finance,,Business & Economics (Intl),"25 years of international stock market information from over 45 stock exchanges, industry sectors and 800 stock indices."dataServices084,DataServices,Mexican Migration Project,http://mmp.opr.princeton.edu/,Population Migration,Mexico,,migrants,population migration,hispanic americans,Population & Demography,"Contains survey data for 6,000 households in 30 communities in Mexico and the United States surveyed from 1982/1983 to present to study Mexican migration to the United States."dataServices085,DataServices,Millennium Indicators,http://millenniumindicators.un.org/unsd/mdg/Default.aspx,Education,Poverty,Health,,,,Education,"Official data, definitions, methodologies, and sources for more than 60 indicators to measure progress towards the UN's Millennium Development Goals. Approach data by country and then theme or via the country profiles."dataServices086,DataServices,Mintel,https://arch.library.nyu.edu/databases/proxy/NYU01175,Market Research,,,,,,Business & Economics (Intl),"As a globally recognized market analyst, Mintel produces some 600 reports into European, UK-specific and US consumer markets every year. Log in required (please contact the Bobst Library reference desk at x2600)."dataServices087,DataServices,Monthly Labor Review,http://www.bls.gov/opub/mlr/mlrhome.htm,Labor,Employment,Consumer Price Indexes,,,,Business & Economics (US),"Provides descriptions and data on labor statistics covering employment, unemployment, hours, earnings, consumer and producer price indexes, wages and work stoppages."dataServices088,DataServices,National Accounts,http://titania.sourceoecd.org/vl=1466913/cl=12/nw=1/rpsv/statistic/s18_about.htm?jnlissn=16081188,Economic Indicators,,,Economic Indicators,,,Business & Economics (US),"National accounts including GDP by type of economic activity, and consumption expenditures by type and purpose. Main aggregates and comparative tables for 25 countries."dataServices089,DataServices,OECD iLibrary - National Accounts Statistics,http://titania.sourceoecd.org/vl=4252041/cl=11/nw=1/rpsv/cgi-bin/jsearch_oecd_stats,Economic Indicators,,,Economic Indicators,,,Business & Economics (Intl),"The most comprehensive source for national accounts statistics; detailed statistics for 168 countries include GDP, private final consumption by type, capital transactions of the nation, general government income and much more. Although it is very detailed, it is very late to be released and is usually several years behind."dataServices090,DataServices,National Archive of Criminal Justice Data,http://www.icpsr.umich.edu/NACJD/,Criminology,Offenses,Criminal Justice,,,,Policy & Political Science,The primary activities of NACJD are the archiving and distribution of computer-readable crime and justice data collections.dataServices091,DataServices,National Assessment of Educational Progress,http://nces.ed.gov/nationsreportcard/,Education,,,,,,Education,"Extensive reports on national and state test scores of 4th, 8th, and 12th grade students by various demographic characteristics; separate surveys on science, mathematics, history, geography. A bibliography lists published NAEP documents since 1970."dataServices092,DataServices,National Association of State Boards of Education State Profiles,http://nasbe.org/index.php/file-repository?func=select&id=67,Education,,,education,educational policy,education expenditures,Education,NASBE is non-profit organization founded to strengthen state leadership in educational policymaking. Statistics for each state are listed.dataServices093,DataServices,National Atlas,http://www.nationalatlas.gov/,GIS,,,,,,Geographic Information Systems,Online US national government agency data presented as GIS map layers.dataServices094,DataServices,National Center for Education Statistics,http://nces.ed.gov/surveys/,Education,Statistics,,,,,Education,"National data on schools, enrollment, and outcomes for all levels of education; on-line data is located under two sections of the main menu: Encyclopedia of ED Stats and Survey and Program Areas and includes elementary, secondary, and higher education statistics; library, literacy, and international statistics. Also includes the Schools Staffing Survey and Integrated Post-Secondary Education Survey, codebooks and press releases."dataServices095,DataServices,National Center for Health Statistics,http://www.cdc.gov/nchswww/default.htm,Health,Aging,,,,,"Health, Nursing & Nutrition","A large collection of data on health and vital statistics, including births, aging, marriages, health care, physical activity, morbidity and mortality."dataServices096,DataServices,National Child Care Information Center State Datasets,http://nccic.org/statedata/index.html,Child Care,,,,,,Area & Cultural Studies,"Data include demographic information about children, licensing requirements for family and center child care, as well as contact information for different State agencies involved in child care."dataServices098,DataServices,National Education Longitudinal Study of 1988,http://nces.ed.gov/surveys/nels88/,Education,,,,,,Education,"A nationally representative sample of eighth-graders were first surveyed in the spring of 1988. A sample of these respondents were then resurveyed through four follow-ups in 1990, 1992, 1994, and 2000. On the questionnaire, students reported on a range of topics including: school, work, and home experiences; educational resources and support; the role in education of their parents and peers; neighborhood characteristics; educational and occupational aspirations; and other student perceptions."dataServices099,DataServices,National Endowment for the Arts,http://www.nea.gov/,Arts,,,arts,arts funding,arts participation,Art,"A sampling of research reports reveal information on government spending and the arts, art as an economic activity, the employment situation of artists, public participation in the arts, and the demographic characteristics of art patrons. Often the research reports lead one back to other sources of information collected by the federal government."dataServices101,DataServices,National Income and Product Accounts of the United States,http://www.bea.gov/bea/dn/nipaweb/,Labor,Trade,Financial Indicators,,,,Business & Economics (US),"Historical compilation of the estimates of the national income and product accounts covered in the Survey of Current Business. These figures show the production, distribution and use of the nation's output."dataServices102,DataServices,Medical Expenditure Panel Survey,http://meps.ahrq.gov/mepsweb/,Medicine,Health,Economics,health care,health care costs,health insurance,"Health, Nursing & Nutrition","The Medical Expenditure Panel Survey (MEPS) is a set of large-scale surveys of families and individuals, their medical providers, and employers across the United States. MEPS is the most complete source of data on the cost and use of health care and health insurance coverage."dataServices103,DataServices,National Nuclear Data Center,http://www.nndc.bnl.gov/,Nuclear Physics,,,,,,Science & Technology,"The National Nuclear Data Center (NNDC) collects, evaluates, and disseminates nuclear physics data for basic nuclear research and for applied nuclear technologies."dataServices104,DataServices,NCES Projections of Education Statistics to 2017,http://nces.ed.gov/programs/projections/projections2017/,Education,,,,,,Education,"Provides 10-year projections of statistics for elementary and secondary schools and institutions of higher education; includes enrollments, graduates, teachers, and expenditures. Older projection reports are also available."dataServices105,DataServices,NIST Chemistry WebBook,http://webbook.nist.gov/,Chemistry,,,,,,Science & Technology,"Provides access to data compiled and distributed by the National Institute of Standards and Technology (NIST) Standard Reference Data Program. Data includes thermochemical, thermophysical, ion energies, etc."dataServices106,DataServices,NIST Physical Measurement Laboratory Physical Reference Data,http://physics.nist.gov/PhysRefData/contents.html,Physics,,,,,,Science & Technology,"The Physical Measurement Laboratory (PML) develops and disseminates the national standards of length, mass, force and shock, acceleration, time and frequency, electricity, temperature, humidity, pressure and vacuum, liquid and gas flow, and electromagnetic, optical, microwave, acoustic, ultrasonic, and ionizing radiation."dataServices107,DataServices,Odum Institute for Research In Social Science,http://arc.irss.unc.edu/dvn/,Data Archive,Public Opinion,,,,,Data Archives,"The Odum Institute maintains one of the oldest and largest catalog of machine-readable data in the U.S. It has an extensive collection of U.S. Census data, including one of the most complete holdings for 1970 Census files. Other major sources of data include the North Carolina State Data Center, which distributes North Carolina census data; and the National Center for Health Statistics."dataServices108,DataServices,OECD iLibrary - International Direct Investment Statistics ,http://lysander.sourceoecd.org/vl=1146862/cl=14/nw=1/rpsv/statistic/s14_about.htm?jnlissn=16081080,Economic Indicators,,,,,,Business & Economics (Intl),"A good source for in-depth economic and political analysis. Includes short and long term prospects, comparisons from year to year and country to country. One for each of the OECD countries."dataServices109,DataServices,OECD iLibrary - Agriculture & Food,http://lysander.sourceoecd.org/vl=1146862/cl=14/nw=1/rpsv/statistic/s1_about.htm?jnlissn=16081056,Economic Indicators,,,,,,Business & Economics (Intl),"A good source for in-depth economic and political analysis. Includes short and long term prospects, comparisons from year to year and country to country. One for each of the OECD countries."dataServices110,DataServices,OECD iLibrary - Bank Profitability,http://lysander.sourceoecd.org/vl=1146862/cl=14/nw=1/rpsv/statistic/s2_about.htm?jnlissn=16081064,Economic Indicators,,,,,,Business & Economics (Intl),"A good source for in-depth economic and political analysis. Includes short and long term prospects, comparisons from year to year and country to country. One for each of the OECD countries."dataServices111,DataServices,OECD iLibrary - Economic Outlook,http://lysander.sourceoecd.org/vl=1146862/cl=14/nw=1/rpsv/statistic/s3_about.htm?jnlissn=16081153,Economic Indicators,,,,,,Business & Economics (Intl),"A good source for in-depth economic and political analysis. Includes short and long term prospects, comparisons from year to year and country to country. One for each of the OECD countries."dataServices112,DataServices,OECD iLibrary - Education Statistics (formerly SourceOECD Education at a Glance),http://lysander.sourceoecd.org/vl=1146862/cl=14/nw=1/rpsv/statistic/s4_about.htm?jnlissn=16081250,Economic Indicators,,,,,,Business & Economics (Intl),"A good source for in-depth economic and political analysis. Includes short and long term prospects, comparisons from year to year and country to country. One for each of the OECD countries."dataServices113,DataServices,OECD iLibrary - Employment and Labour Markets,http://lysander.sourceoecd.org/vl=1146862/cl=14/nw=1/rpsv/statistic/s5_about.htm?jnlissn=16081161,Economic Indicators,,,,,,Business & Economics (Intl),"A good source for in-depth economic and political analysis. Includes short and long term prospects, comparisons from year to year and country to country. One for each of the OECD countries."dataServices114,DataServices,OECD iLibrary - Globalisation,http://lysander.sourceoecd.org/vl=1146862/cl=14/nw=1/rpsv/statistic/s6_about.htm?jnlissn=16081293,Economic Indicators,,,,,,Business & Economics (Intl),"A good source for in-depth economic and political analysis. Includes short and long term prospects, comparisons from year to year and country to country. One for each of the OECD countries."dataServices115,DataServices,OECD iLibrary - Indicators of Industry and Services,http://lysander.sourceoecd.org/vl=1146862/cl=14/nw=1/rpsv/statistic/s7_about.htm?jnlissn=16081196,Economic Indicators,,,,,,Business & Economics (Intl),"A good source for in-depth economic and political analysis. Includes short and long term prospects, comparisons from year to year and country to country. One for each of the OECD countries."dataServices116,DataServices,OECD iLibrary - Institutional Investors,http://lysander.sourceoecd.org/vl=1146862/cl=14/nw=1/rpsv/statistic/s9_about.htm?jnlissn=16081072,Economic Indicators,,,,,,Business & Economics (Intl),"A good source for in-depth economic and political analysis. Includes short and long term prospects, comparisons from year to year and country to country. One for each of the OECD countries."dataServices117,DataServices,OECD iLibrary - Insurance,http://lysander.sourceoecd.org/vl=1146862/cl=14/nw=1/rpsv/statistic/s10_about.htm?jnlissn=16812026,Economic Indicators,,,,,,Business & Economics (Intl),"A good source for in-depth economic and political analysis. Includes short and long term prospects, comparisons from year to year and country to country. One for each of the OECD countries."dataServices118,DataServices,OECD iLibrary - International Development,http://lysander.sourceoecd.org/vl=1146862/cl=14/nw=1/rpsv/statistic/s11_about.htm?jnlissn=16081110,Economic Indicators,,,,,,Business & Economics (Intl),"A good source for in-depth economic and political analysis. Includes short and long term prospects, comparisons from year to year and country to country. One for each of the OECD countries."dataServices119,DataServices,OECD iLibrary - International Migration Statistics,http://lysander.sourceoecd.org/vl=1146862/cl=14/nw=1/rpsv/statistic/s12_about.htm?jnlissn=16081269,Economic Indicators,,,,,,Business & Economics (Intl),"A good source for in-depth economic and political analysis. Includes short and long term prospects, comparisons from year to year and country to country. One for each of the OECD countries."dataServices120,DataServices,OECD iLibrary - International Trade and Competitiveness Indicators,http://lysander.sourceoecd.org/vl=1146862/cl=14/nw=1/rpsv/statistic/s13_about.htm?jnlissn=16081145,Economic Indicators,,,,,,Business & Economics (Intl),"A good source for in-depth economic and political analysis. Includes short and long term prospects, comparisons from year to year and country to country. One for each of the OECD countries."dataServices121,DataServices,OECD iLibrary - ITCS International Trade by Commodity Database,http://lysander.sourceoecd.org/vl=1146862/cl=14/nw=1/rpsv/statistic/s15_about.htm?jnlissn=16081218,Economic Indicators,,,,,,Business & Economics (Intl),"A good source for in-depth economic and political analysis. Includes short and long term prospects, comparisons from year to year and country to country. One for each of the OECD countries."dataServices122,DataServices,OECD iLibrary - Main Economic Indicators,http://lysander.sourceoecd.org/vl=1146862/cl=14/nw=1/rpsv/statistic/s16_about.htm?jnlissn=16081234,Economic Indicators,,,,,,Business & Economics (Intl),"A good source for in-depth economic and political analysis. Includes short and long term prospects, comparisons from year to year and country to country. One for each of the OECD countries."dataServices123,DataServices,OECD iLibrary - Monthly Statistics of International Trade,http://fiordiliji.sourceoecd.org/vl=4718250/cl=19/nw=1/rpsv/statistic/s17_about.htm?jnlissn=16081226,Economic Indicators,,,,,,Business & Economics (Intl),"A good source for in-depth economic and political analysis. Includes short and long term prospects, comparisons from year to year and country to country. One for each of the OECD countries."dataServices124,DataServices,OECD iLibrary - National Accounts Database,http://fiordiliji.sourceoecd.org/vl=4718250/cl=19/nw=1/rpsv/statistic/s18_about.htm?jnlissn=16081188,Economic Indicators,,,,,,Business & Economics (Intl),"A good source for in-depth economic and political analysis. Includes short and long term prospects, comparisons from year to year and country to country. One for each of the OECD countries."dataServices125,DataServices,OECD iLibrary - OECD Health Data 2007,http://lysander.sourceoecd.org/vl=1146862/cl=14/nw=1/rpsv/statistic/s37_about.htm?jnlissn=99991012,Economic Indicators,,,,,,Business & Economics (Intl),"A good source for in-depth economic and political analysis. Includes short and long term prospects, comparisons from year to year and country to country. One for each of the OECD countries."